{"Valgart":"Folketingsvalg","Valgdag":"24-03-2026","FrigivelsesTidspunktUTC":"24-03-2026 15:07:00","Kommune":"Slagelse","Kommunekode":330,"Afstemningsområde":"Skælskør - Skælskør Badmintoncenter","AfstemningsområdeDagiId":"720074","AfstemningsområdeNummer":6,"Valgdeltagelse":[{"AntalStemmeberretigedeVælgere":6386,"AfgivneStemmer":2049,"Tidspunkt":"12:00:00"},{"AntalStemmeberretigedeVælgere":6386,"AfgivneStemmer":2708,"Tidspunkt":"14:00:00"},{"AntalStemmeberretigedeVælgere":6386,"AfgivneStemmer":3566,"Tidspunkt":"16:00:00"}]}