{"Valgart":"Folketingsvalg","Valgdag":"24-03-2026","FrigivelsesTidspunktUTC":"24-03-2026 13:03:54","Kommune":"Gentofte","Kommunekode":157,"Afstemningsområde":"Rådhuset","AfstemningsområdeDagiId":"702884","AfstemningsområdeNummer":3,"Valgdeltagelse":[{"AntalStemmeberretigedeVælgere":5768,"AfgivneStemmer":1238,"Tidspunkt":"08:00:00"},{"AntalStemmeberretigedeVælgere":5768,"AfgivneStemmer":1685,"Tidspunkt":"09:00:00"},{"AntalStemmeberretigedeVælgere":5768,"AfgivneStemmer":1882,"Tidspunkt":"10:00:00"},{"AntalStemmeberretigedeVælgere":5768,"AfgivneStemmer":2105,"Tidspunkt":"11:00:00"},{"AntalStemmeberretigedeVælgere":5768,"AfgivneStemmer":2355,"Tidspunkt":"12:00:00"},{"AntalStemmeberretigedeVælgere":5768,"AfgivneStemmer":2576,"Tidspunkt":"13:00:00"},{"AntalStemmeberretigedeVælgere":5768,"AfgivneStemmer":2789,"Tidspunkt":"14:00:00"}]}