{"Valgart":"Folketingsvalg","Valgdag":"24-03-2026","FrigivelsesTidspunktUTC":"24-03-2026 08:09:17","Kommune":"Aarhus","Kommunekode":751,"Afstemningsområde":"Skjoldhøjskolen, Tilst","AfstemningsområdeDagiId":"710040","AfstemningsområdeNummer":26,"Valgdeltagelse":[{"AntalStemmeberretigedeVælgere":4023,"AfgivneStemmer":471,"Tidspunkt":"09:00:00"}]}