{"Valgart":"Folketingsvalg","Valgdag":"24-03-2026","FrigivelsesTidspunktUTC":"24-03-2026 10:06:32","Kommune":"Hørsholm","Kommunekode":223,"Afstemningsområde":"Rungsted","AfstemningsområdeDagiId":"707688","AfstemningsområdeNummer":3,"Valgdeltagelse":[{"AntalStemmeberretigedeVælgere":3432,"AfgivneStemmer":547,"Tidspunkt":"08:00:00"},{"AntalStemmeberretigedeVælgere":3432,"AfgivneStemmer":806,"Tidspunkt":"09:00:00"},{"AntalStemmeberretigedeVælgere":3432,"AfgivneStemmer":979,"Tidspunkt":"10:00:00"},{"AntalStemmeberretigedeVælgere":3432,"AfgivneStemmer":1186,"Tidspunkt":"11:00:00"}]}