{"Valgart":"Folketingsvalg","Valgdag":"24-03-2026","FrigivelsesTidspunktUTC":"24-03-2026 11:27:56","Kommune":"Jammerbugt","Kommunekode":849,"Afstemningsområde":"Vedsted","AfstemningsområdeDagiId":"711896","AfstemningsområdeNummer":4,"Valgdeltagelse":[{"AntalStemmeberretigedeVælgere":882,"AfgivneStemmer":257,"Tidspunkt":"12:00:00"}]}