{"Valgart":"Folketingsvalg","Valgdag":"24-03-2026","FrigivelsesTidspunktUTC":"24-03-2026 14:00:17","Kommune":"Svendborg","Kommunekode":479,"Afstemningsområde":"Egense","AfstemningsområdeDagiId":"705328","AfstemningsområdeNummer":7,"Valgdeltagelse":[{"AntalStemmeberretigedeVælgere":2167,"AfgivneStemmer":411,"Tidspunkt":"09:23:00"},{"AntalStemmeberretigedeVælgere":2167,"AfgivneStemmer":694,"Tidspunkt":"11:00:00"},{"AntalStemmeberretigedeVælgere":2167,"AfgivneStemmer":944,"Tidspunkt":"13:00:00"},{"AntalStemmeberretigedeVælgere":2167,"AfgivneStemmer":1144,"Tidspunkt":"15:00:00"}]}