{"Valgart":"Folketingsvalg","Valgdag":"24-03-2026","FrigivelsesTidspunktUTC":"24-03-2026 11:01:08","Kommune":"Frederikshavn","Kommunekode":813,"Afstemningsområde":"Skagen","AfstemningsområdeDagiId":"705148","AfstemningsområdeNummer":1,"Valgdeltagelse":[{"AntalStemmeberretigedeVælgere":5409,"AfgivneStemmer":653,"Tidspunkt":"09:00:00"},{"AntalStemmeberretigedeVælgere":5409,"AfgivneStemmer":1050,"Tidspunkt":"10:00:00"},{"AntalStemmeberretigedeVælgere":5409,"AfgivneStemmer":1878,"Tidspunkt":"12:00:00"}]}