{"Valgart":"Folketingsvalg","Valgdag":"24-03-2026","FrigivelsesTidspunktUTC":"24-03-2026 13:21:28","Kommune":"Horsens","Kommunekode":615,"Afstemningsområde":"Lund","AfstemningsområdeDagiId":"710912","AfstemningsområdeNummer":9,"Valgdeltagelse":[{"AntalStemmeberretigedeVælgere":3456,"AfgivneStemmer":449,"Tidspunkt":"09:00:00"},{"AntalStemmeberretigedeVælgere":3456,"AfgivneStemmer":609,"Tidspunkt":"10:00:00"},{"AntalStemmeberretigedeVælgere":3456,"AfgivneStemmer":786,"Tidspunkt":"11:00:00"},{"AntalStemmeberretigedeVælgere":3456,"AfgivneStemmer":982,"Tidspunkt":"12:00:00"},{"AntalStemmeberretigedeVælgere":3456,"AfgivneStemmer":1141,"Tidspunkt":"13:00:00"},{"AntalStemmeberretigedeVælgere":3456,"AfgivneStemmer":1288,"Tidspunkt":"14:00:00"}]}