{"Valgart":"Folketingsvalg","Valgdag":"24-03-2026","FrigivelsesTidspunktUTC":"24-03-2026 15:11:17","Kommune":"Brønderslev","Kommunekode":810,"Afstemningsområde":"Stenum","AfstemningsområdeDagiId":"702304","AfstemningsområdeNummer":34,"Valgdeltagelse":[{"AntalStemmeberretigedeVælgere":462,"AfgivneStemmer":103,"Tidspunkt":"12:00:00"},{"AntalStemmeberretigedeVælgere":462,"AfgivneStemmer":231,"Tidspunkt":"16:00:00"}]}