{"Valgart":"Folketingsvalg","Valgdag":"24-03-2026","FrigivelsesTidspunktUTC":"24-03-2026 13:06:55","Kommune":"Herning","Kommunekode":657,"Afstemningsområde":"Ørnhøj","AfstemningsområdeDagiId":"705030","AfstemningsområdeNummer":30,"Valgdeltagelse":[{"AntalStemmeberretigedeVælgere":784,"AfgivneStemmer":69,"Tidspunkt":"09:00:00"},{"AntalStemmeberretigedeVælgere":784,"AfgivneStemmer":161,"Tidspunkt":"11:00:00"},{"AntalStemmeberretigedeVælgere":784,"AfgivneStemmer":264,"Tidspunkt":"14:00:00"}]}