{"Valgart":"Folketingsvalg","Valgdag":"24-03-2026","FrigivelsesTidspunktUTC":"24-03-2026 18:02:20","Kommune":"Nyborg","Kommunekode":450,"Afstemningsområde":"Skellerup","AfstemningsområdeDagiId":"703760","AfstemningsområdeNummer":8,"Valgdeltagelse":[{"AntalStemmeberretigedeVælgere":416,"AfgivneStemmer":37,"Tidspunkt":"09:00:00"},{"AntalStemmeberretigedeVælgere":416,"AfgivneStemmer":62,"Tidspunkt":"10:00:00"},{"AntalStemmeberretigedeVælgere":416,"AfgivneStemmer":87,"Tidspunkt":"11:00:00"},{"AntalStemmeberretigedeVælgere":416,"AfgivneStemmer":108,"Tidspunkt":"12:00:00"},{"AntalStemmeberretigedeVælgere":416,"AfgivneStemmer":129,"Tidspunkt":"13:00:00"},{"AntalStemmeberretigedeVælgere":416,"AfgivneStemmer":144,"Tidspunkt":"14:00:00"},{"AntalStemmeberretigedeVælgere":416,"AfgivneStemmer":172,"Tidspunkt":"15:00:00"},{"AntalStemmeberretigedeVælgere":416,"AfgivneStemmer":212,"Tidspunkt":"16:00:00"},{"AntalStemmeberretigedeVælgere":416,"AfgivneStemmer":269,"Tidspunkt":"17:00:00"},{"AntalStemmeberretigedeVælgere":416,"AfgivneStemmer":315,"Tidspunkt":"18:00:00"},{"AntalStemmeberretigedeVælgere":416,"AfgivneStemmer":342,"Tidspunkt":"19:00:00"}]}