{"Valgart":"Folketingsvalg","Valgdag":"24-03-2026","FrigivelsesTidspunktUTC":"24-03-2026 10:06:02","Kommune":"Hjørring","Kommunekode":860,"Afstemningsområde":"Hundelev","AfstemningsområdeDagiId":"710482","AfstemningsområdeNummer":20,"Valgdeltagelse":[{"AntalStemmeberretigedeVælgere":762,"AfgivneStemmer":54,"Tidspunkt":"09:00:00"},{"AntalStemmeberretigedeVælgere":762,"AfgivneStemmer":124,"Tidspunkt":"11:00:00"}]}