{"Valgart":"Folketingsvalg","Valgdag":"24-03-2026","FrigivelsesTidspunktUTC":"24-03-2026 14:14:50","Kommune":"Aarhus","Kommunekode":751,"Afstemningsområde":"Samsøgades Skole, Aarhus C","AfstemningsområdeDagiId":"711398","AfstemningsområdeNummer":41,"Valgdeltagelse":[{"AntalStemmeberretigedeVælgere":7076,"AfgivneStemmer":1363,"Tidspunkt":"09:00:00"},{"AntalStemmeberretigedeVælgere":7076,"AfgivneStemmer":2291,"Tidspunkt":"11:30:00"},{"AntalStemmeberretigedeVælgere":7076,"AfgivneStemmer":3690,"Tidspunkt":"15:00:00"}]}