{"Valgart":"Folketingsvalg","Valgdag":"24-03-2026","FrigivelsesTidspunktUTC":"24-03-2026 10:04:32","Kommune":"Ballerup","Kommunekode":151,"Afstemningsområde":"Grantoftehallen","AfstemningsområdeDagiId":"710158","AfstemningsområdeNummer":4,"Valgdeltagelse":[{"AntalStemmeberretigedeVælgere":3421,"AfgivneStemmer":358,"Tidspunkt":"09:00:00"},{"AntalStemmeberretigedeVælgere":3421,"AfgivneStemmer":463,"Tidspunkt":"10:00:00"}]}