{"Valgart":"Folketingsvalg","Valgdag":"24-03-2026","FrigivelsesTidspunktUTC":"24-03-2026 15:01:59","Kommune":"Fredensborg","Kommunekode":210,"Afstemningsområde":"Karlebo","AfstemningsområdeDagiId":"700760","AfstemningsområdeNummer":8,"Valgdeltagelse":[{"AntalStemmeberretigedeVælgere":950,"AfgivneStemmer":116,"Tidspunkt":"09:00:00"},{"AntalStemmeberretigedeVælgere":950,"AfgivneStemmer":169,"Tidspunkt":"10:00:00"},{"AntalStemmeberretigedeVælgere":950,"AfgivneStemmer":210,"Tidspunkt":"11:00:00"},{"AntalStemmeberretigedeVælgere":950,"AfgivneStemmer":250,"Tidspunkt":"12:00:00"},{"AntalStemmeberretigedeVælgere":950,"AfgivneStemmer":306,"Tidspunkt":"13:00:00"},{"AntalStemmeberretigedeVælgere":950,"AfgivneStemmer":340,"Tidspunkt":"14:00:00"},{"AntalStemmeberretigedeVælgere":950,"AfgivneStemmer":387,"Tidspunkt":"15:00:00"},{"AntalStemmeberretigedeVælgere":950,"AfgivneStemmer":478,"Tidspunkt":"16:00:00"}]}