{"Valgart":"Folketingsvalg","Valgdag":"24-03-2026","FrigivelsesTidspunktUTC":"24-03-2026 18:02:34","Kommune":"Rødovre","Kommunekode":175,"Afstemningsområde":"Valhøj","AfstemningsområdeDagiId":"707814","AfstemningsområdeNummer":4,"Valgdeltagelse":[{"AntalStemmeberretigedeVælgere":3805,"AfgivneStemmer":447,"Tidspunkt":"09:03:00"},{"AntalStemmeberretigedeVælgere":3805,"AfgivneStemmer":590,"Tidspunkt":"10:05:00"},{"AntalStemmeberretigedeVælgere":3805,"AfgivneStemmer":774,"Tidspunkt":"11:03:00"},{"AntalStemmeberretigedeVælgere":3805,"AfgivneStemmer":1007,"Tidspunkt":"12:03:00"},{"AntalStemmeberretigedeVælgere":3805,"AfgivneStemmer":1135,"Tidspunkt":"13:00:00"},{"AntalStemmeberretigedeVælgere":3805,"AfgivneStemmer":1518,"Tidspunkt":"14:01:00"},{"AntalStemmeberretigedeVælgere":3805,"AfgivneStemmer":1521,"Tidspunkt":"15:02:00"},{"AntalStemmeberretigedeVælgere":3805,"AfgivneStemmer":1832,"Tidspunkt":"16:01:00"},{"AntalStemmeberretigedeVælgere":3805,"AfgivneStemmer":2158,"Tidspunkt":"17:00:00"},{"AntalStemmeberretigedeVælgere":3805,"AfgivneStemmer":2470,"Tidspunkt":"18:00:00"},{"AntalStemmeberretigedeVælgere":3805,"AfgivneStemmer":2698,"Tidspunkt":"19:02:00"}]}