{"Valgart":"Folketingsvalg","Valgdag":"24-03-2026","FrigivelsesTidspunktUTC":"24-03-2026 16:03:20","Kommune":"Ikast-Brande","Kommunekode":756,"Afstemningsområde":"Engesvang","AfstemningsområdeDagiId":"713316","AfstemningsområdeNummer":4,"Valgdeltagelse":[{"AntalStemmeberretigedeVælgere":2279,"AfgivneStemmer":221,"Tidspunkt":"09:00:00"},{"AntalStemmeberretigedeVælgere":2279,"AfgivneStemmer":346,"Tidspunkt":"10:00:00"},{"AntalStemmeberretigedeVælgere":2279,"AfgivneStemmer":589,"Tidspunkt":"12:00:00"},{"AntalStemmeberretigedeVælgere":2279,"AfgivneStemmer":803,"Tidspunkt":"14:00:00"},{"AntalStemmeberretigedeVælgere":2279,"AfgivneStemmer":1135,"Tidspunkt":"16:00:00"},{"AntalStemmeberretigedeVælgere":2279,"AfgivneStemmer":1401,"Tidspunkt":"17:00:00"}]}