{"Valgart":"Folketingsvalg","Valgdag":"24-03-2026","FrigivelsesTidspunktUTC":"24-03-2026 12:12:48","Kommune":"Rudersdal","Kommunekode":230,"Afstemningsområde":"Toftevang","AfstemningsområdeDagiId":"705784","AfstemningsområdeNummer":6,"Valgdeltagelse":[{"AntalStemmeberretigedeVælgere":5619,"AfgivneStemmer":893,"Tidspunkt":"08:00:00"},{"AntalStemmeberretigedeVælgere":5619,"AfgivneStemmer":1238,"Tidspunkt":"09:00:00"},{"AntalStemmeberretigedeVælgere":5619,"AfgivneStemmer":1484,"Tidspunkt":"10:00:00"},{"AntalStemmeberretigedeVælgere":5619,"AfgivneStemmer":1758,"Tidspunkt":"11:00:00"},{"AntalStemmeberretigedeVælgere":5619,"AfgivneStemmer":2062,"Tidspunkt":"12:00:00"},{"AntalStemmeberretigedeVælgere":5619,"AfgivneStemmer":2327,"Tidspunkt":"13:00:00"}]}