{"Valgart":"Folketingsvalg","Valgdag":"24-03-2026","FrigivelsesTidspunktUTC":"24-03-2026 13:04:27","Kommune":"Lejre","Kommunekode":350,"Afstemningsområde":"Rye","AfstemningsområdeDagiId":"707756","AfstemningsområdeNummer":2,"Valgdeltagelse":[{"AntalStemmeberretigedeVælgere":2002,"AfgivneStemmer":240,"Tidspunkt":"09:00:00"},{"AntalStemmeberretigedeVælgere":2002,"AfgivneStemmer":357,"Tidspunkt":"10:00:00"},{"AntalStemmeberretigedeVælgere":2002,"AfgivneStemmer":480,"Tidspunkt":"11:00:00"},{"AntalStemmeberretigedeVælgere":2002,"AfgivneStemmer":634,"Tidspunkt":"12:00:00"},{"AntalStemmeberretigedeVælgere":2002,"AfgivneStemmer":746,"Tidspunkt":"13:00:00"},{"AntalStemmeberretigedeVælgere":2002,"AfgivneStemmer":847,"Tidspunkt":"14:00:00"}]}