{"Valgart":"Folketingsvalg","Valgdag":"24-03-2026","FrigivelsesTidspunktUTC":"24-03-2026 10:06:31","Kommune":"Middelfart","Kommunekode":410,"Afstemningsområde":"Middelfart Ø","AfstemningsområdeDagiId":"708394","AfstemningsområdeNummer":2,"Valgdeltagelse":[{"AntalStemmeberretigedeVælgere":5628,"AfgivneStemmer":1143,"Tidspunkt":"10:00:00"}]}