{"Valgart":"Folketingsvalg","Valgdag":"24-03-2026","FrigivelsesTidspunktUTC":"24-03-2026 13:10:25","Kommune":"Lolland","Kommunekode":360,"Afstemningsområde":"Birket","AfstemningsområdeDagiId":"706808","AfstemningsområdeNummer":26,"Valgdeltagelse":[{"AntalStemmeberretigedeVælgere":341,"AfgivneStemmer":46,"Tidspunkt":"10:00:00"},{"AntalStemmeberretigedeVælgere":341,"AfgivneStemmer":124,"Tidspunkt":"12:00:00"},{"AntalStemmeberretigedeVælgere":341,"AfgivneStemmer":158,"Tidspunkt":"14:00:00"}]}