{"Valgart":"Folketingsvalg","Valgdag":"24-03-2026","FrigivelsesTidspunktUTC":"24-03-2026 14:00:32","Kommune":"Roskilde","Kommunekode":265,"Afstemningsområde":"Svogerslev","AfstemningsområdeDagiId":"705900","AfstemningsområdeNummer":7,"Valgdeltagelse":[{"AntalStemmeberretigedeVælgere":3331,"AfgivneStemmer":507,"Tidspunkt":"09:00:00"},{"AntalStemmeberretigedeVælgere":3331,"AfgivneStemmer":956,"Tidspunkt":"11:00:00"},{"AntalStemmeberretigedeVælgere":3331,"AfgivneStemmer":1346,"Tidspunkt":"13:00:00"},{"AntalStemmeberretigedeVælgere":3331,"AfgivneStemmer":1720,"Tidspunkt":"15:00:00"}]}