{"Valgart":"Folketingsvalg","Valgdag":"24-03-2026","FrigivelsesTidspunktUTC":"24-03-2026 17:03:50","Kommune":"Rebild","Kommunekode":840,"Afstemningsområde":"Nørager","AfstemningsområdeDagiId":"712164","AfstemningsområdeNummer":5,"Valgdeltagelse":[{"AntalStemmeberretigedeVælgere":2117,"AfgivneStemmer":600,"Tidspunkt":"12:00:00"},{"AntalStemmeberretigedeVælgere":2117,"AfgivneStemmer":1504,"Tidspunkt":"18:00:00"}]}