{"Valgart":"Folketingsvalg","Valgdag":"24-03-2026","FrigivelsesTidspunktUTC":"24-03-2026 17:26:16","Kommune":"København","Kommunekode":101,"Afstemningsområde":"2. Øst","AfstemningsområdeDagiId":"725346","AfstemningsområdeNummer":57,"Valgdeltagelse":[{"AntalStemmeberretigedeVælgere":7486,"AfgivneStemmer":2634,"Tidspunkt":"12:00:00"},{"AntalStemmeberretigedeVælgere":7486,"AfgivneStemmer":4193,"Tidspunkt":"16:00:00"},{"AntalStemmeberretigedeVælgere":7486,"AfgivneStemmer":5541,"Tidspunkt":"18:00:00"}]}